"Dear American Airlines, I would like to publicly thank and compliment Ms. Teresa Todd in Detroit Metro Airport for her outstanding service. I was checking in for a flight to D.C. when I had left my folder with important documents at the counter. She had paged me multiple times throughout the terminal and eventually came all the way to the gate where I was scheduled to depart for my flight and handed the folder to me. Thank you Ms. Todd for your great act of kindness and service. The folder was crucial to my travel and work and I would've been in a big mess if it weren't for you, so thank you again. Best,Lee"
"Absolutely pathetic customer service from American Airlines.. First, they cancelled the flight to Orlando and informed me, and many other fliers, two hours before the scheduled departure. Second, they gave us another flight the next day, while they gave us the reason that due to weather they could not fly to Orlando. They lied, they had fights flying to Miami the same day, 30 mins later. Third, I asked for a refund, since they were unable to give me a confirmed seat the same day, but they could not do that either.Absolutely unhelpful behavior from the customer service agents at the airport, a flight full of people stranded at the airport and they had 2 people responding at the desks. Very very unprofessional."
This has been the worse flying experience I have ever had. No information about what is going on. Minimal last minute direction spoken rudely by staff. Never again. Don't do it people. It's not worth the price you pay. What in the world happened to AA?
I will never fly American Airlines again they have the worst customer service ..I purchased 3 tickets and needed to Change the date that I was flying due to some medical things that I needed to have taken care of before I could fly out ..I was told that it would be $300 extra per each ticket that I purchased  Which is totally ridiculous.. Absolutely the worst experience I have ever had flying in my life .If you're thinking about flying American Airlines think again.. They are not accommodating at all and could care less about how you feel as a customer I am all around just unhappy ..
"This is why American Airlines is terrible! at the world of business with a skeptical eye and a firmly rooted tongue in cheek. These are difficult times for American Airlines.The unpleasant dispute with its mechanics is beginning to wear on the airline's ability to maintain good service. Worse, the airline's financial performance has been wearing at Wall Street's worry beads.Adding to this turbulent atmosphere, passengers haven't exactly been ululating with glee at the airline's new, so-called Oasis configuration.That's the one that shoves more seats into planes, reduces legroom for all passengers, and, as a cherry on top, inserts tiny bathrooms. Some passengers are apparently avoiding these bathrooms entirely, preferring to hold their bodily functions in until they land. Oh, and the seatback screens are no more, though the overhead bins are bigger.Some might wonder whether all these woes are related.Last week, one financial big-brain finally plucked up the courage to air that thought to American's CEO, Doug Parker.At the JP Morgan Aviation, Transportation and Industrials Conference, Jamie Baker -- who works for JP Morgan -- wondered whether there was some relationship between the airline's poor financial performance and ""the Oasis experience.""As View From The Wing's Gary Leff reported, Baker added: ""Maybe it's the configuration of the aircraft that's holding you back, from a revenue perspective?""Could it be this idea hadn't quite entered the minds of American's management? It's surely well known that if you treat your customers poorly, they may not continue using your service.It's also true that American has become the poster infant for domestic customer mistreatment. Then again, for the longest time Parker didn't even bother trying the new Oasis product. He didn't even understand why anyone would care that he hadn't. When he finally tried it, he offered a lukewarm review.Perhaps that's why Parker, according to Leff, took this brutally direct question and offered a painfully evasive response. As Leff writes:""He did not talk about retrofitting the domestic fleet. He did not talk about the domestic (Oasis) product. Instead he acknowledged the revenue gap against Delta and United, suggested 'We were making enormous progress 2015, 2016, 2017' -- notably right before they began rolling out this new inferior product -- 'and then '18 we trailed those two...'Yes, but why did they suddenly begin trailing the other two?Parker performed a pivot. He began to talk about other issues, including American's uncompetitive sub-cattle class (a.k.a. basic economy) product.Finally, there was an explanation that may affect some customers' breathing.Parker said American was ""behind Delta on merchandising."" Ah, so the product is wonderful. It's just that American is marketing it poorly.Can't you see this, American customers? Why can't you see this?All airlines have their issues. But to blame the performance of something that's manifestly not a good idea -- how can reducing legroom in first class ever be a way to attract more business travelers? -- on how you're selling it borders on the risible.In previous pronouncements, Parker suggested the larger overhead bins and improved WiFi are the most important elements of the new configuration.Fly American. The symbiosis of WiFi and thrombosis!Parker has also declared that what passengers care about most is whether their flight arrives on time.Perhaps, though, it's worth Parker considering whether degrading the essential comfort of a plane might make customers feel uncomfortable about his brand.Customers have power and sometimes they wield it.They'd wield it even more if they had more choice as to which airlines they can fly."
"Ok, so I guess I'm partial on this one, but I LOVE AA, especially in DTW! 1) because I work for them, and 2) because I'm originally from Detroit. I no longer live here, but every time I travel through here, I'm greeted with smiling faces and a friendly hello. Never are there long lines, and I love the power charging station. It's a nice clean new airport, and never have any issues flying through here! AA is such a great airline, always trying to stay ahead of the game!"
"Well, American did it again.  Same son. Different trip. He was supposed to fly out to Las Vegas just after Christmas.  His flight was cancelled an hour before take-off because they hadn't ""recovered"" from the storms over 24 hours before. Bad enough that it was cancelled but if it was due to a storm from 24 hours before, didn't they know it would be cancelled before that?So he returned the next day for his rescheduled flight.  Flight delayed, then canceled. AA custv suggested he take a later flight into Chicago and HOPE that the connector is delayed.  What kind of advice is that?  He didn't do it, and good thing. He would have been stranded in Chicago.Next flight out:  2 days later.  American Airlines stole 3+ days from my son's trip, and they wouldn't even offer him food vouchers for the times he was stuck at the airport waiting for a ride back home. Never ever again."
