"I'm sooo annoyed! I should not be in the awkward position of having to ask the passenger in the seat next to me to wear a mask. I was on a flight from DFW to San Diego and a guy comes onto the plane not wearing a mask. He can't find his seat so takes the empty one next to me. I was excited about the extra leg room of empty seat because I had a leg injury, but the flight attendant let's him sit in the empty next to me instead of showing him his correct seat 10 rows back. During the whole interaction the guy wasn't wearing a mask and noone seemed bothered.  For the next 10 minutes I stew in the seat next to him not wanting to be mask police but not wanting to possibly get my granddaughter sick when I see her the next day. Meanwhile the speaker system puts out the covid 19 message about noone being allowed to take their mask off at any time, serious offense, taking all precautions,  bla, bla bla. I was furious that the flight attendant came back to ask me to put my backpack up, but still not asking him to mask up. At that instant I asked the guy if he had a mak and he pulled a bandana out of his pocket. I then spent the next 30 minutes with him being pissed at me about calling him out on it! It shouldn't be my responsibility! How uncomfortable will my 2 1/2 hour flight be now?!?! Please American Airlines...do your job...don't make passengers do it for you!!!"
Fly any other airline: The manager's actions today 11:30am April 30th 2021 at American Airlines ticketing in San Diego (SAN) solidified we will NEVER be flying AA again. She was blatantly incorrect about an active duty military pet policy. She called two superiors and both quickly confirmed I was 100% correct. She refused to acknowledge us again and we were forced back in line. Customers around us were just as shocked as we were as she walked away in the wrong.
"Wait, 1 and half star?  I think I'll need more Dramamine after reading all the negative reviews.  Of course, I can't help but to side with my fellow Yelp Elites but with that being said; I'll start my review with 5 stars.  Checking in went through smoothly and the $25 luggage fee (1 luggage)  wasn't too expensive.  Boarding was organized and quick.  Sweet plane with good size TV and close enough to my face.  Plane left on time and I am loving my adjustable head rest.  All I can really ask for is to fly safely and land gracefully."
"First of all, let's start off by saying that I got to my destination alive and that is the most important thing. Aside from that, the configuration on the American planes are very tight. You are really crammed in there. The seats in some rows were stuck in the recline position,  meaning they are broken. In general, the cosmetics of the interior look to be in mediocre condition. I will always choose Southwest before American, but in this case it made more financial sense to go American."
"My husband and I used our miles to book tickets to Greece for our Honeymoon. Although we purchased the tickets separately, I selected seats in advance so we could sit next to each other. Upon check-in, we were very disappointed to see that somehow our seats had been changed and we were no longer near each other for the 11-hour international flight. I explained this to the AA representative, requesting to be relocated next to each other. We were told to wait and were passed off to another AA representative at the boarding gate, who in a very condescending tone told us ""yes... but you're going to have to pay for it."" We were super insulted and off-put by the customer service exchange that we decided not to pay over $100 per ticket to get seats next to each other when we had originally booked adjoining seats. Not only was this our honeymoon, but my husband recently opened an AA credit card and this was our first experience back with American Airlines since COVID. It was incredibly disappointing."
Flight attendant ramming my knee with a drink cart and not apologizing. Extremely rude gate agents. Mishandled and damaged luggage...and most recently not helping my pregnant wife move her seat from a window to an aisle. This 1 star is long overdue for AA. Hot tip: It's not that hard to figure out the CEO's email address ;-) ;-) Hopefully it you figure it out you'll get for then the BS courtesy call that I got.
Start your review of American Airlines.
"Very deceptive airlines with condescending employees. I booked my ticket with air miles and unknown to me.. apparently there is a basic economy ticket. This basic airline ticket has an American Airlines price tag with a spirit airlines business motto (you pay for everything!) if it doesn't fit under your seat, thenIt's $25 for overhead space. Well, I didn't know this and I get to the gate.. and now it's $50 to check a bag!! I questioned it and the employees were rude and very "" you should know better."" I will try to avoid flying with American Airlines.. I rather pay half the price and fly with spirit and expect the extra charges."
One stars just because the plane didn't fall out of the sky. They delayed my partner for 15 hours in an airport with no help and no alternative routes out. We had to figure it out ourselves. 500$ ticket so we could have an early arrival down the drain. I would've been fine with a just even a 100$ discount for the inconvenience but they laughed me off the phone for asking. Never flying AA again. Completely unhelpful. Covid packed flights.
This airline does not care about the safety of their staff or customers just the headline. Y'all evil for letting that man harass the attendants and punishing them for keeping the flight safe. I would never give my mone to a company who said I don't care they drunk harassed and groped a team member. Trash company.
Our American Airlines Check-in desk in San Diego are so Rude and aggressive with the customers
Called to change my ticket and after waiting 2 hours for a call back I got scolded for not having my ticket info ready and was transferred to the end of call survey without changing my flight. Now I have to wait another 2 hours which will be past my new flight time so I have to spend another $300-400 to stay another night. People who work as customer service representative have to like people and want to help them. The person I talked to was very rude and did not want to help me. Bad management decision to hire this person in this position. Will try to not fly American Airline ever again and will let everyone I know on social media know too.
Terrible terrible terrible terrible!!! Avoid flying this airline and the SD location at all costs! Worst customer service at the San Diego airport! I arrived on time to check a bag and was told i cannot check because it was full. They had no other flights and would not give me a refund for a 500 dollar flight. Also 'supervisor' on duty was extremely rude and told me there's nothing she can do. Absolutely horrendous! Never again. I will continue to give bad reviews as well. Avoid!!!!
"Worst airline ever. I wish I could tell you how inconsiderate customer service was. To start, they cancelled my flight from the US to London and did not notify me or my family (who was traveling with me). I did not find out until 24 hrs before when I attempted to check in. This would mean I would miss my connection flight to Jordan. THEN after HOURS of calling and waiting on hold at about 1 am they booked us a flight at 9am. Of course, we had scheduled our covid tests 72 before flight and we were still waiting for results. If our flight was at its regular time (7pm) we would have had our results. Because it was moved way earlier, we did not have our results and could not take the flight. FURTHERMORE, the 2 ladies who were at customer service were both rude. Separately. One had me fill out online applications  for about 30 min (that I had already done for the cancelled flight) and then did not look at them. The other was just flat out RUDE I can't explain. Everything a person could do to make things more difficult ~ she did ~ 0/5"
American Airlines stranded me in Europe.   They cancelled a flight I had booked with miles and stated that no other flights were available to rebook.  I had to buy a one way ticket last minute from Geneva to San Diego.
They no longer have customer service. Hours long holding times.  Website is dysfunctional. Can't accommodate change of flights of individual travelers. Look forward to their bankruptcy.
"Today 12/28 American announced plans to place the notorious 737 Max planes in service.Last week, Air Canada experienced engine failure issues that required an emergency landing.BEWARE...DO NOT FLY THESE PLANES. They are unsafe by design and the FAA and airlines all know it."
"Your trust is our top concern, so businesses can't pay to alter or remove their reviews. Learn more."
Start your review of American Airlines.
"American Airlines used to be one of my favorite airlines to fly with.  However recently their customer service has really gone down hill.  I booked 3 flights with them over seas and then upgraded to first class.  All was well, then I had to change my flight due to covid to a later date.  They refused to transfer my first class seats for the exact same flights at a later date.  They made me jump through hoops to talk to the right people which I never really got to talk to.  They all kept blaming a different department. Saying they could not help me.  In the end they made me go back into couch and they gave me a credit for what I originally paid for my upgrade and told me if I wanted to upgrade on this new flight I could pay 1400 for each person.  INSANE!  I also had 3 additional flights with them I have since canceled or changed due to them constantly changing flight times.  If you can help it I would fly with a different airline at this time."
"Aa does not fail to fail. The last time I was here they had one gate agent when the day started at 5am. The line was around the terminal. Today was the first time that my Husky roller was confiscated.  Nobody else challenged its ability to fit in the overhead.  Not Charlotte, Dallas,  Chicago, Boston, BWI etc. The agents were not rude, but they had a heavy Barney Fife / DMV vibe. The 5 am pic is attached."
"Word of warning...your carryon bag must be smaller than the posted measurements.  I was stopped at the gate today because my bag did not fit completely INSIDE the white lines not AT the limits of the white lines.  Funny how I've traveled many times on many airlines with this exact Samsonite bag.  If I wanted to check a bag, I would have done so with a bag that doesn't meet the size limitations.Delta- I'm begging you to provide more flights from PHX.  I want to continue being a loyal customer to you but American and Southwest dominates my city.Maybe it's worth paying more money to have a better experience."
The AA ticket counter at San Diego Airport might have the worst nasty disrespectful ugly employe work at this ticket counter. He is old white man in his 60 with white hair with a nasty attitude that will do whatever he can to make your life miserable. He treated me with a 3 month old like crazy just because he thought the baby's stroller was too big. Idiot. We missed the flight seating there explaining to him. Stay away from that nasty man and pick a diffrent agent next time.
"Called today to inquire why my flight is non-refundable 50 days out.... Wait time was over four hours so I opted for a return phone call. No refunds from American Airline in these still difficult travel times.... United, Alaskan, and  Southwest are all still giving refund to try and help customers out."
"Can never open this app without resetting the password which involves countless delays.  My suit bag, I was told I had to check even though there are countless spaces including the coat area at the front of the plane.  Delayed flight naturally (it's sunny across the USA) and no help from the front desk"
"DONNA WILSON a very rude and disrespectful customer service rep.Today 8/29- I asked her if she can seat me and my travel buddies together.  Immediately she responded with attitude . Here's her response, I HAVE a family of six and other people ahead of you besides you purchased an economy seats and you can't choose seats. She didn't even ask my boarding pass or at least say hi..   I responded, I am only asking you a question with a yes and no answer not asking you to tell me other customers issue. Why you hired people that don't know how to respect others. She is representing AA with that kind of attitude! This is the first time I  encountered a rep with such horrible attitude.DONNA WILSON you need to behave lady!!!!!!!!! This person don't deserve a star at all."
"There is a guy here checking people in as they board who is beyond awful. So minus like a zillion stars for that guy. I saw him being rude to many people in line and if I see him again I will get his name and put him on blast. I know it sucks to deal with people all day, but if you can't do it then quit because there is a line of people ready to take your job! It really hurts the energy of everyone going on the flight and makes it even more miserable. Phew!Other then that this is an airline much like any other. I dig that you can save enough points to cover a flight pretty fast, and that they have a lot of options. The in flight service varies but I usually never have a problem. Much to Camilla the Yelping Hen's horror they count her as a ""bag."" So before we board I have to stuff her in my backpack. Then I have to deal with an upset hen all the rest of the journey. Makes 4 year olds look like angels on a flight...Seriously though when you fly with AA you are usually going to have a solid flight. Sometimes if they like you then you get free wine. Watch for the half bottles they offer on longer flights. Go ahead and judge but I need my medicine especially with an irate hen clucking up a storm. It is sorta sad that this airline lacks charm. If I ever have a choice this one is not at the top."
Horrible service i got from American Airlines they ripped my luggage and just. Said they would not be responsible because i had a conection with another carrier but i clearly saw my luggage ripped when i switched planes
This Airline broke my luggage and refuses to reimburse me i can't tell you how upset i am with this company very shady business
Worst airline company ever destroyed my suitcase and never refund me on 1300 dollars i spent customer service ignored my claim never using this company ever again
"So upon arriving at the airport I was told by the united attendant that I could not carry on my bag because I had bought a low cost ticket even though it was the size of a carry-on. OK I say, I'll just fly Southwest next time. From that point on the attendant continue to tell me how many different airlines I could've chosen other than hers. She's right I won't fly United again. Thanks dingbat.  And look at the rest of the reviews people United airlines you're pathetic."
